smartctl 6.6 2016-05-31 r4324 [x86_64-linux-4.15.0-20-generic] (local build)
Copyright (C) 2002-16, Bruce Allen, Christian Franke, www.smartmontools.org

=== START OF INFORMATION SECTION ===
Model Family:     Seagate Barracuda 7200.14 (AF)
Device Model:     ST2000DM001-1CH164
Serial Number:    W1F2J57S
LU WWN Device Id: 5 000c50 06006fa3d
Firmware Version: CC26
User Capacity:    2,000,398,934,016 bytes [2.00 TB]
Sector Sizes:     512 bytes logical, 4096 bytes physical
Rotation Rate:    7200 rpm
Form Factor:      3.5 inches
Device is:        In smartctl database [for details use: -P show]
ATA Version is:   ATA8-ACS T13/1699-D revision 4
SATA Version is:  SATA 3.0, 6.0 Gb/s (current: 6.0 Gb/s)
Local Time is:    Sat Sep 29 14:48:06 2018 CST
SMART support is: Available - device has SMART capability.
SMART support is: Enabled

=== START OF READ SMART DATA SECTION ===
SMART overall-health self-assessment test result: PASSED

General SMART Values:
Offline data collection status:  (0x82)	Offline data collection activity
					was completed without error.
					Auto Offline Data Collection: Enabled.
Self-test execution status:      ( 121)	The previous self-test completed having
					the read element of the test failed.
Total time to complete Offline 
data collection: 		(  600) seconds.
Offline data collection
capabilities: 			 (0x7b) SMART execute Offline immediate.
					Auto Offline data collection on/off support.
					Suspend Offline collection upon new
					command.
					Offline surface scan supported.
					Self-test supported.
					Conveyance Self-test supported.
					Selective Self-test supported.
SMART capabilities:            (0x0003)	Saves SMART data before entering
					power-saving mode.
					Supports SMART auto save timer.
Error logging capability:        (0x01)	Error logging supported.
					General Purpose Logging supported.
Short self-test routine 
recommended polling time: 	 (   1) minutes.
Extended self-test routine
recommended polling time: 	 ( 252) minutes.
Conveyance self-test routine
recommended polling time: 	 (   2) minutes.
SCT capabilities: 	       (0x3085)	SCT Status supported.

SMART Attributes Data Structure revision number: 10
Vendor Specific SMART Attributes with Thresholds:
ID# ATTRIBUTE_NAME          FLAG     VALUE WORST THRESH TYPE      UPDATED  WHEN_FAILED RAW_VALUE
  1 Raw_Read_Error_Rate     0x000f   105   099   006    Pre-fail  Always       -       102131172
  3 Spin_Up_Time            0x0003   094   093   000    Pre-fail  Always       -       0
  4 Start_Stop_Count        0x0032   100   100   020    Old_age   Always       -       156
  5 Reallocated_Sector_Ct   0x0033   100   100   010    Pre-fail  Always       -       0
  7 Seek_Error_Rate         0x000f   058   055   030    Pre-fail  Always       -       51547819375
  9 Power_On_Hours          0x0032   097   097   000    Old_age   Always       -       3472
 10 Spin_Retry_Count        0x0013   100   100   097    Pre-fail  Always       -       0
 12 Power_Cycle_Count       0x0032   100   100   020    Old_age   Always       -       108
183 Runtime_Bad_Block       0x0032   100   100   000    Old_age   Always       -       0
184 End-to-End_Error        0x0032   100   100   099    Old_age   Always       -       0
187 Reported_Uncorrect      0x0032   088   088   000    Old_age   Always       -       12
188 Command_Timeout         0x0032   100   100   000    Old_age   Always       -       1 1 1
189 High_Fly_Writes         0x003a   096   096   000    Old_age   Always       -       4
190 Airflow_Temperature_Cel 0x0022   060   051   045    Old_age   Always       -       40 (Min/Max 29/46)
191 G-Sense_Error_Rate      0x0032   100   100   000    Old_age   Always       -       0
192 Power-Off_Retract_Count 0x0032   100   100   000    Old_age   Always       -       82
193 Load_Cycle_Count        0x0032   100   100   000    Old_age   Always       -       453
194 Temperature_Celsius     0x0022   040   049   000    Old_age   Always       -       40 (0 13 0 0 0)
197 Current_Pending_Sector  0x0012   090   075   000    Old_age   Always       -       1768
198 Offline_Uncorrectable   0x0010   090   075   000    Old_age   Offline      -       1768
199 UDMA_CRC_Error_Count    0x003e   200   200   000    Old_age   Always       -       0
240 Head_Flying_Hours       0x0000   100   253   000    Old_age   Offline      -       3424h+49m+01.304s
241 Total_LBAs_Written      0x0000   100   253   000    Old_age   Offline      -       7419168413
242 Total_LBAs_Read         0x0000   100   253   000    Old_age   Offline      -       22430773874

SMART Error Log Version: 1
ATA Error Count: 24 (device log contains only the most recent five errors)
	CR = Command Register [HEX]
	FR = Features Register [HEX]
	SC = Sector Count Register [HEX]
	SN = Sector Number Register [HEX]
	CL = Cylinder Low Register [HEX]
	CH = Cylinder High Register [HEX]
	DH = Device/Head Register [HEX]
	DC = Device Command Register [HEX]
	ER = Error register [HEX]
	ST = Status register [HEX]
Powered_Up_Time is measured from power on, and printed as
DDd+hh:mm:SS.sss where DD=days, hh=hours, mm=minutes,
SS=sec, and sss=millisec. It "wraps" after 49.710 days.

Error 24 occurred at disk power-on lifetime: 3469 hours (144 days + 13 hours)
  When the command that caused the error occurred, the device was active or idle.

  After command completion occurred, registers were:
  ER ST SC SN CL CH DH
  -- -- -- -- -- -- --
  40 51 00 ff ff ff 0f  Error: WP at LBA = 0x0fffffff = 268435455

  Commands leading to the command that caused the error were:
  CR FR SC SN CL CH DH DC   Powered_Up_Time  Command/Feature_Name
  -- -- -- -- -- -- -- --  ----------------  --------------------
  61 00 28 00 49 cd 42 00   9d+03:24:23.691  WRITE FPDMA QUEUED
  60 00 08 ff ff ff 4f 00   9d+03:24:23.691  READ FPDMA QUEUED
  61 00 18 ff ff ff 4f 00   9d+03:24:23.687  WRITE FPDMA QUEUED
  60 00 08 ff ff ff 4f 00   9d+03:24:23.687  READ FPDMA QUEUED
  60 00 08 ff ff ff 4f 00   9d+03:24:23.687  READ FPDMA QUEUED

Error 23 occurred at disk power-on lifetime: 3469 hours (144 days + 13 hours)
  When the command that caused the error occurred, the device was active or idle.

  After command completion occurred, registers were:
  ER ST SC SN CL CH DH
  -- -- -- -- -- -- --
  40 51 00 ff ff ff 0f  Error: WP at LBA = 0x0fffffff = 268435455

  Commands leading to the command that caused the error were:
  CR FR SC SN CL CH DH DC   Powered_Up_Time  Command/Feature_Name
  -- -- -- -- -- -- -- --  ----------------  --------------------
  61 00 28 00 49 cd 42 00   9d+03:24:23.691  WRITE FPDMA QUEUED
  60 00 08 ff ff ff 4f 00   9d+03:24:23.691  READ FPDMA QUEUED
  61 00 18 ff ff ff 4f 00   9d+03:24:23.687  WRITE FPDMA QUEUED
  60 00 08 ff ff ff 4f 00   9d+03:24:23.687  READ FPDMA QUEUED
  60 00 08 ff ff ff 4f 00   9d+03:24:23.687  READ FPDMA QUEUED

Error 22 occurred at disk power-on lifetime: 3469 hours (144 days + 13 hours)
  When the command that caused the error occurred, the device was active or idle.

  After command completion occurred, registers were:
  ER ST SC SN CL CH DH
  -- -- -- -- -- -- --
  40 51 00 ff ff ff 0f  Error: WP at LBA = 0x0fffffff = 268435455

  Commands leading to the command that caused the error were:
  CR FR SC SN CL CH DH DC   Powered_Up_Time  Command/Feature_Name
  -- -- -- -- -- -- -- --  ----------------  --------------------
  61 00 40 ff ff ff 4f 00   9d+03:24:20.819  WRITE FPDMA QUEUED
  60 00 08 ff ff ff 4f 00   9d+03:24:20.819  READ FPDMA QUEUED
  60 00 08 ff ff ff 4f 00   9d+03:24:20.819  READ FPDMA QUEUED
  60 00 08 ff ff ff 4f 00   9d+03:24:20.819  READ FPDMA QUEUED
  60 00 08 ff ff ff 4f 00   9d+03:24:20.819  READ FPDMA QUEUED

Error 21 occurred at disk power-on lifetime: 3469 hours (144 days + 13 hours)
  When the command that caused the error occurred, the device was active or idle.

  After command completion occurred, registers were:
  ER ST SC SN CL CH DH
  -- -- -- -- -- -- --
  40 51 00 ff ff ff 0f  Error: WP at LBA = 0x0fffffff = 268435455

  Commands leading to the command that caused the error were:
  CR FR SC SN CL CH DH DC   Powered_Up_Time  Command/Feature_Name
  -- -- -- -- -- -- -- --  ----------------  --------------------
  61 00 40 ff ff ff 4f 00   9d+03:24:20.819  WRITE FPDMA QUEUED
  60 00 08 ff ff ff 4f 00   9d+03:24:20.819  READ FPDMA QUEUED
  60 00 08 ff ff ff 4f 00   9d+03:24:20.819  READ FPDMA QUEUED
  60 00 08 ff ff ff 4f 00   9d+03:24:20.819  READ FPDMA QUEUED
  60 00 08 ff ff ff 4f 00   9d+03:24:20.819  READ FPDMA QUEUED

Error 20 occurred at disk power-on lifetime: 3469 hours (144 days + 13 hours)
  When the command that caused the error occurred, the device was active or idle.

  After command completion occurred, registers were:
  ER ST SC SN CL CH DH
  -- -- -- -- -- -- --
  40 51 00 ff ff ff 0f  Error: WP at LBA = 0x0fffffff = 268435455

  Commands leading to the command that caused the error were:
  CR FR SC SN CL CH DH DC   Powered_Up_Time  Command/Feature_Name
  -- -- -- -- -- -- -- --  ----------------  --------------------
  61 00 08 ff ff ff 4f 00   9d+03:24:17.688  WRITE FPDMA QUEUED
  61 00 40 ff ff ff 4f 00   9d+03:24:17.688  WRITE FPDMA QUEUED
  61 00 10 ff ff ff 4f 00   9d+03:24:17.688  WRITE FPDMA QUEUED
  61 00 08 ff ff ff 4f 00   9d+03:24:17.688  WRITE FPDMA QUEUED
  61 00 40 ff ff ff 4f 00   9d+03:24:17.687  WRITE FPDMA QUEUED

SMART Self-test log structure revision number 1
Num  Test_Description    Status                  Remaining  LifeTime(hours)  LBA_of_first_error
# 1  Short offline       Completed: read failure       90%      3472         1564612120
# 2  Short offline       Completed: read failure       90%      3472         1564612120
# 3  Short offline       Completed: read failure       90%      3472         1564612120
# 4  Short offline       Completed: read failure       90%      3472         1564612120
# 5  Short offline       Completed: read failure       90%      3472         1564612120
# 6  Short offline       Completed: read failure       90%      3472         1564612120
# 7  Short offline       Completed: read failure       90%      3471         1564612120
# 8  Short offline       Completed: read failure       90%      3471         1564612120
# 9  Short offline       Completed: read failure       90%      3470         1564612120
#10  Short offline       Completed: read failure       90%      3470         1564612120
#11  Short offline       Completed: read failure       90%      3470         1564612120
#12  Short offline       Completed: read failure       90%      3469         1564612120
#13  Short offline       Completed: read failure       90%      3469         1564612120
#14  Short offline       Completed: read failure       90%      3469         1564612120
#15  Short offline       Completed: read failure       90%      3469         1564612120
#16  Short offline       Completed without error       00%      3444         -
#17  Short offline       Completed without error       00%      3425         -
#18  Short offline       Completed without error       00%      3420         -
#19  Short offline       Completed without error       00%      3420         -
#20  Short offline       Completed without error       00%      3420         -
#21  Short offline       Completed without error       00%      3420         -

SMART Selective self-test log data structure revision number 1
 SPAN  MIN_LBA  MAX_LBA  CURRENT_TEST_STATUS
    1        0        0  Not_testing
    2        0        0  Not_testing
    3        0        0  Not_testing
    4        0        0  Not_testing
    5        0        0  Not_testing
Selective self-test flags (0x0):
  After scanning selected spans, do NOT read-scan remainder of disk.
If Selective self-test is pending on power-up, resume after 0 minute delay.

